,Job Title,Salary Estimate,Job Description,Rating,Company Name,Location,Headquarters,Size,Founded,Type of ownership,Industry,Sector,Revenue,Competitors
11,SEO Analyst,-1,"Devada is committed to empowering developers. Our mission is to harness the incredible power of technology and bring developer practitioners, advocates, and inspiring novices alike together in community through our product and platform offerings. Recognizing that developers sit at the hub of innovation in many different kinds of companies, we offer solutions that drive knowledge sharing, foster communities for collaboration, and facilitate learning and growth.

Since 2005, Devada has been empowering developers to learn, share, grow, and succeed via the technology-specific web communities we enable. Our media property, DZone.com, is one of the world's largest communities of user-contributed technical learning resources. DZone.com is visited by millions of developers each month who utilize the site to learn and share insights and best practices on software tools, technologies and best practices.

Do you have a passion for working with talented people as well as curating, optimizing, and publishing compelling content for a global audience of software professionals? Do you want to help drive the strategy behind unique content that educates developers, improves organic search visibility, and builds trust in the DZone brand? Devada is hiring an SEO Analyst to join our growing DZone.com Editorial team, which drives all content related activities for our community of software developers around the world.

Editorial excellence and search optimization of web content are always on your brain. You will be expected to learn what topics align best to target audiences of the brand. This role will implement the functional search optimization strategy and monitor content performance to ensure overall strategic business goals are met. This role will work closely with members of the Editorial team to optimize search engine content that drives viewers directly back to DZone.com

What You Will Do:
Perform keyword research in coordination with content strategy objectives to optimize existing and future content
Monitor and administer web analytics dashboards, reports and key reporting tools, and point out key areas of importance in accordance with content objectives
Monitor and evaluate search results and search performance across the major search channels
Utilize tools to perform keyword research and ensure growth of DZone.com's targeted keyword portfolio
Collaborate closely with the editorial team to implement best practices in SEO, improve organic search, and ensure strategic business goals are being met
Develop editorial standards, guidelines, and processes so content meets contributory guidelines
Edit, revise and reformat content to publish on a daily schedule
What We Look For:
Minimum of 5 years' experience combination of editing and building strategy of online content for one or more consumer websites (as a web editor, managing editor or similar).
Bachelor's degree in journalism, communications, English, or related field of study, or commensurate experience preferred.
Exceptional organizational and project management skills. Proven experience working with large scale, fast paced content production.
Self-Starter with journalistic curiosity who learns quickly and is willing and eager to adapt with the business.
Must understand how to clearly communicate requirements to contributors, colleagues, and vendors.
Knowledgeable in SEO and user-generated content.
Excellent grammar and punctuation skills with strong abilities to write and edit copy under publication deadlines.
Understands needs of online publishing, including HTML, CSS formatting, and Content Management Systems (CMS
In tune with competitive and editorial landscape in our market (developer communities and producers of technical publications)
Preferred but not required:
Prior experience or work with a digital media company
Experience in editing for web channels
Working for Devada

At Devada, ""developer"" is in our DNA. Our products and services are specifically focused on building and supporting great online communities for software developers to learn and share knowledge. Our software platform, AnswerHub, is used by the world's largest development organizations to give both internal developers and partners a place to share technical knowledge. Our media property, DZone.com, is home to one of the world's largest online communities for developers.

We're growing fast, but we are determined that each and every person has the opportunity to make a difference for our company and our customers each and every day. We encourage creativity and collaboration and thrive on continuous improvement. We hire purposefully for passion, self-motivation, intelligence, curiosity and adaptability.

Devada has been listed in the Inc. 5000's list of fastest growing private companies for five years running, and we are seeking great people to help us continue our rapid growth. We are headquartered in Research Triangle Park, North Carolina.",3.7,"DZone
3.7","Research Triangle Park, NC","Research Triangle Park, NC",51 to 200 employees,2005,Company - Private,Enterprise Software & Network Solutions,Information Technology,$10 to $25 million (USD),-1
12,Technical SEO Analyst (Remote - Fluent in English),-1,"Why You Should Apply

Our company is devoted to winning for clients, and our team members. You will work side by side top talent within a company that has a fun, fast-paced culture. We listen to your ideas and use them.

We provide training and opportunities for growth, all while working from home as our team is 100% remote. You will receive competitive pay, paid time off, paid holidays, full medical, dental and vision coverage, as well as other benefits.

Full-time employees have the option of taking a half day on Fridays as long as they have put in 40 hours for the week and all of their work is completed. Full-time employees are also eligible for quarterly profit sharing bonuses after 12 months of employment.

If you are organized, a solid communicator, motivated to succeed for clients and have the experience we are looking for, we would love to have you apply today!


Position Overview

The primary role of the Technical SEO Specialist is to analyze and execute search engine optimization campaigns for a small portfolio of client websites. This must be done within a defined scope, time and cost based on the requirements and constraints of specific campaigns.

The Technical SEO Specialist works closely with the Marketing Analyst, Digital Strategist and Digital Marketing Manager to consistently improve client ROI. While the primary focus of the role is on complete SEO-based work, conversion rate optimization (CRO) is also a part of the role.

Although this is primarily a technical role, you will be required to attend all internal meetings and the occasional video call with clients.


What You Will Do

Work closely within a team to provide value to clients
Complete all assigned technical SEO tasks
Execute tests, collect and analyze data and results, identify trends and insights in order to achieve maximum ROI in paid search campaigns
Track, report, and analyze website analytics and social media and campaigns
Manage campaign expenses, staying on budget, estimating monthly costs and reconciling discrepancies
Optimize copy and landing pages for search engine optimization
Perform ongoing keyword discovery, expansion and optimization
Research and implement search engine optimization recommendations
Research and analyze competitor websites and online presence
Develop and implement link building strategy
Work with the development team to ensure SEO best practices are properly implemented on newly developed code
Work with editorial and marketing teams to drive SEO in content creation and content programming
Recommend changes to website architecture, content, linking and other factors to improve SEO positions for target keywords


What We’re Looking For

""A"" players
Proactivity, ownership, confidence and motivation to grow
Ability to create digital marketing strategies and break them down to the task level
An ability to stay organized, meet multiple deadlines and pay attention to details in an open, fast-paced and entrepreneurial environment
Proven technical SEO experience
Experience with A/B and multivariate experiments
A true love of organization and keeping things organized
Data driven thinking as this is a very technical and data rich environment
Excellent communication skills - within the team, other departments and with external clients
Experience with optimizing WordPress websites
Ability to follow up on tasks so they get completed, without nagging team members
In-depth experience with common SEO tools (Google Analytics, Google Search Console, SEMrush, Ahrefs, Majestic, Moz, DeepCrawl, etc)
Knowledge of ranking factors and search engine algorithms
Manage client budgets and campaign resources
Microsoft Excel and Google Sheets for data analysis including function mastery and pivot tables
Ability to create and help the team execute on digital marketing strategies
Experience working in the digital marketing and SEO industry
Solid understanding of performance marketing, conversion, and online customer acquisition
Ability to manage multiple campaign projects, clients and deadlines
Understanding of the legal industry and how law firms work is a plus
Up-to-date with the latest trends and best practices in SEO, SEM, PPC and social media
Working knowledge of HTML, CSS, and JavaScript development and constraints
Experience with Agile project management methodologies (Scrum, Kanban, etc) is a plus
A quiet dedicated home work environment with reliable high-speed internet access


What We Offer

A competitive salary based on your experience.
A great PTO package.
Quarterly profit-sharing bonuses and 401k participation after your first year of employment.
Health insurance benefits after your first 60 days with options for dental and vision.
Opportunities for career growth and advancement within the company
In-house training and professional development through seminars and conferences (tell us what you want to learn, and we’ll give you our support)
Our annual company conference, with training sessions, team-building activities, contests with fun prizes (an Amazon Echo or iPad, for instance), outstanding meals and highly competitive softball and bowling tournaments.
The opportunity to work with passionate, determined online marketing experts from across the country and around the globe who bring not only their talents to the table but their unique personalities and interests as well.


To apply, visit the Consultwebs Careers page.",4.3,"Consultwebs.com Inc.
4.3","Raleigh, NC","Raleigh, NC",51 to 200 employees,1999,Company - Private,Advertising & Marketing,Business Services,Unknown / Non-Applicable,-1
13,Analyst - Metals and Chemistry,-1,"ABOUT MICROBAC

Microbac serves our clients with the utmost expertise and respect for their market requirements, constraints and challenges. We embody a company-wide commitment to exceptional customer experience, which has been refined over nearly 50 years of trusted, analytical and measurement experience.

Through our network of laboratories, offices, and field services, we have the flexibility to meet the unique requirements for each client, project and scope.

As a privately held third-party testing company, Microbac operates with a commitment to safety, quality and compliance. Our diverse work portfolio includes broad accreditation offerings and tested insights across the environmental, food and nutrition and life science markets.

JOB SUMMARY

The Analyst I, working in an accredited commercial laboratory, provides a variety of routine scientific tasks under close supervision. Receives specific and detailed instructions as to required tasks and results expected.

ESSENTIAL FUNCTIONS
Following established SOP's and adhering to state, federal and other accrediting body requirements, prepare and process samples, and collect information about the composition of substances to support the analytical testing needs of clients, for such purposes as quantitative analysis, and product development
Prepare necessary standards, solutions, reagents, media, and samples for sample analyses
Utilize specialized laboratory equipment and instrumentation to process and analyze samples
Perform equipment and instrumentation set up
Accurately record observations and data and basic interpretation of data
Maintain the integrity of procedures and record professional activity for peer review
Monitor and address sample backlog issues
Maintain accurate, up to date logs, notebooks and equipment records
Perform necessary laboratory administrative functions such as filing paperwork, photocopying, reviewing of data, and entering data into computerized LIMS
Comply with and promote Safety, and Quality programs
MINIMUM REQUIREMENTS
Bachelor's degree with a major in an applied science from a four-year college or university; or two to three years related experience; or equivalent combination of education and experience.
Basic knowledge of principles, terminology, practices, techniques and instrumentation commonly used in a laboratory setting
Ability to effectively prioritize work and manage time to meet deadlines and rush orders
Computer literacy
Ability to work with delicate laboratory equipment
Ability to communicate effectively in both written and verbal formats
WORKING CONDITIONS AND PHYSICAL REQUIREMENTS

The physical demands described here are representative of those that must be met by an employee to successfully perform the essential functions of this job. Reasonable accommodations may be made to enable individuals with disabilities to perform the essential functions.

Physical Requirements:
While performing the duties of this job, the employee is regularly required to use hands to finger, handle, or feel objects, tools, or controls; talk or hear; and taste or smell. The employee is occasionally required to stand, walk, and sit.
The employee must regularly lift and/or move up to 25 pounds. Specific vision abilities required by this job include close vision, distance vision, color vision, peripheral vision, and depth perception.
Working Conditions:
While performing the duties of this job, the employee frequently works near moving mechanical parts and is frequently exposed to fumes or airborne particles and toxic or caustic chemicals
The noise level in the work environment is usually moderate
Microbac is an Equal Opportunity Employer Minorities/Females/Veterans/Disability/Sexual Orientation/Gender Identity

Veteran Friendly Employer

SDL2017",2.5,"Microbac
2.5","Fayetteville, NC","Pittsburgh, PA",501 to 1000 employees,1969,Company - Private,Biotech & Pharmaceuticals,Biotech & Pharmaceuticals,$100 to $500 million (USD),-1
