,Job Title,Salary Estimate,Job Description,Rating,Company Name,Location,Headquarters,Size,Founded,Type of ownership,Industry,Sector,Revenue,Competitors
6,"Digital Strategist, Paid Media",-1,"Overview

We're looking for a Digital Strategist, Paid Media expert to join our ranks. An individual deeply ingrained in digital and social media culture, and who understands the dynamics of online and off-line community-building. This individual will play a crucial supportive role at Ketchum, helping clients reach and engage with enthusiast communities; playing an active role in business development; helping develop and evangelize a company-wide perspective on the use of emerging media. In other words, the ideal candidate is someone who thrives on working in a highly visible, brain-bending, massively multitasking capacity at the cutting edge where communications and technology come together.

The Digital Strategist, Paid Media expert will serve as a supporting strategist and network educator across Ketchum and Ketchum Digital on current and emerging paid media platforms and 360 advertising options. This position will also maintain and grow relationships between advertising platforms and Ketchum owned digital paid media agency partners. This position works across our Global network in one of the most critical, fastest growing areas of one of our most exciting teams.

About the Job

Paid Media Integration
Assist Paid team leadership in driving development and execution of paid digital media strategies
Assist senior digital strategy / account teams with the integration and measurement of paid media into Ketchum new and existing client programs
Foster platform relationships with paid vendors including but not limited to: Facebook, Instagram, Pinterest, Snapchat, Twitter, Taboola, Outbrain, LinkedIn, Google, YouTube, and many more digital partners
Perform media planning, media campaign execution, media budget management, monitoring, and measurement/reporting
Establish relationships across the network to streamline paid media efforts and facilitate network-wide paid media trainings: capabilities, best practice, case studies, etc.
Participate in online certifications and professional development of teams
Digital Strategy and Business Development
Demonstrate professional experience in emerging media, with a clear understanding how to apply tools and technology to infuse innovative digital and social strategies into new and existing work
Continually grow understanding and knowledge of client business and their competitive environment; apply this information in preparing and presenting focused programs and recommendations
Assist in education of internal peers and external clients on paid media and digital trends
Identify and assist in building new service offerings in relation to paid media
Build and present concepts and programs, both for clients and for new business proposals and opportunities
Monitor paid media plans and budgets for profitability; report status to client and agency management on a regular basis
Qualifications
Minimum of 2-4 years professional interactive work experience; agency or client-side experience
Bachelor's degree with a concentration in marketing/business/PR/Communications or related field preferred
Experience generating brand/client awareness through existing and emerging social media and online communities and platforms
Experience running paid advertising campaigns on social media (Facebook, Instagram, Twitter, LinkedIn, Pinterest), native advertising and sponsored content, programmatic, video distribution, Google and YouTube ads, and more
Successful track record of building and presenting strategic paid media programs, recommendations and tactics for clients and effectively executing programs
Solid grasp of social, digital, influencer, word-of-mouth marketing, personal and professional experience across the digital and social space, and knowledge of emerging trends and technologies
Strong understanding of community engagement and online campaign experience
Ability to translate paid media platforms, technologies and metrics into succinct, compelling, conversational language for a variety of audiences
An individual who thrives in a fast-paced, dynamic environment, working effectively with colleagues and clients across organizations and geographies
IND13

#LI-ML1

About Ketchum

As a global communications consultancy with 90 plus years of experience, Ketchum is a trusted partner who is equal parts creative and analytical. Ketchum is a place where all perspectives and points of view are welcome and encouraged. We are a collection of communications specialists, content creators, creatives, researchers, data analysts, media pros, digital strategists, issues and crisis counselors, and tech nerds. And we love when those worlds collide to create the very best teams and solutions for our clients. We work with the world's leading brands, emerging start-ups, and everything in between. We are beyond proud to have created some of the most celebrated and award-winning campaigns in our industry. We're just crazy enough to think we can impact the world and how it responds to ideas through communication.

We encourage our employees to be curious, brave, inspiring, and a force for good. Let's talk. Come belong at Ketchum!

What we offer
Robust benefits program
Generous time off policies
Retirement program with company match
Workplace flexibility
Business casual dress code
Workplace and off-site social gatherings
Yoga @ work
Professional learning and development opportunities
Tuition reimbursement
Paid maternity/paternity leave
Transit benefits
Interested? We've got an opportunity for you.

SDL2017",3.6,"Ketchum, Inc.
3.6","Raleigh, NC","New York, NY",1001 to 5000 employees,1923,Subsidiary or Business Segment,Advertising & Marketing,Business Services,Unknown / Non-Applicable,-1
7,Senior Media Buyer - Entertainment and Media Industry Opportunity,-1,"We are seeking a Senior Media Buyer to join our Winston-Salem Mediahub team.Mediahub is one the hottest and fastest growing media shops in the U.S. and was just named Ad Age's 2019 Media Agency of the Year. This is coming off the heels of being named a leader in Forrester's first ever wave of major media shops and in 2018 we were Adweek's U.S. Media Agency of the Year.

The role of the Senior Media Buyer is to negotiate and purchase local media (TV, radio, cable, online, video) in ""spot"" media markets. Candidate must have strong negotiations savvy and solid TV & cable ratings projection skills.

A history of positive maintenance and posting track records are also important.

Requirements
Four-year degree is required.
5-7 years current experience as a local market media buyer.

You must be eligible to work in the United States to be considered for this role.

This job description is subject to change at any time.

Work is regularly performed in a professional office environment and routinely uses standard office equipment. The work environment characteristics described here are representative of those an employee encounters while performing the essential functions of this job. Reasonable accommodations may be made to enable individuals with disabilities to perform the essential functions.

ACCESSIBILITY NOTICE: If you need a reasonable accommodation for any part of the employment process due to a physical or mental disability, please send an email to: disabilityaccommodations@mullenlowe.com - please include your location in the subject line of your email (BOS, NY, LA, WNS)

MullenLowe is an EEO/AA M/F/Disability/Vet Employer.
MullenLowe participates in E-Verify.",3.1,"Mullen
3.1","Winston-Salem, NC","Boston, MA",501 to 1000 employees,1970,Subsidiary or Business Segment,Advertising & Marketing,Business Services,$50 to $100 million (USD),"Droga5, Arnold"
8,Unified Communication Telecom Analyst,-1,"Everyone communicates. It’s the essence of the human experience. How we communicate is evolving. Technology is reshaping the way we live, learn and thrive. The epicenter of this transformation is the network—our passion. Our experts are rethinking the purpose, role and usage of networks to help our customers increase bandwidth, expand capacity, enhance efficiency, speed deployment and simplify migration. From remote cell sites to massive sports arenas, from busy airports to state-of-the-art data centers— we provide the essential expertise and vital infrastructure your business needs to succeed. The world’s most advanced networks rely on CommScope connectivity.

CommScope is searching for a Unified Communication Telecom Analyst to be located in Hickory, NC, Suwanee, GA or Richardson, TX.

Who you’ll work with:

Join a team at CommScope who’s #1 priority is to deliver outstanding customer experience by solving tough business challenges with innovative solutions that accelerate employee and customer success. We are looking for an experienced Unified Communication Analyst to join the team in taking a first-principles approach to the evaluation, design, and implementation of CommScope’s Collaboration related business activities along with support of various IT initiatives. Our current product portfolio includes Cisco Call Manager, Unity Connection, Video / Telepresence, Webex, Collaboration Edge and Call centers, and you’ll need to know some of these to be successful, but we’re hoping you can bring new things to our attention as well!

Who You Are:

A successful candidate is:
Customer focused: Dedicated to understanding customer needs and applying architectural and vertical expertise to multi-functional teams to drive alignment on decisions
Technical Liaison: Technical knowledge with the ability to understand and connect end user or business-related issues with optimal solutions that can be implemented in the environment to accelerate value
Team Player & Influencer: Work across internal and external teams of all levels to encourage technical implementation.
Business Aware: Strong business insight with a clear understanding of high-level business landscape including key strategic priorities, processes, and marketplace
Duties and Responsibilities:

Unified Communication Analyst assists with design, plans for implementation of UC solutions, optimizes processes to improve operational efficiencies, and establishes and documents standards for UC Infrastructure within the Data Centers, Manufacturing plants, and Administrative locations. You will also have the following responsibilities, including but not limited to:
Designs, engineers and manages complex system related communications routing protocols to support Corporate Plans Dial Plan (E164), Call Control principles, Complex Call Routing, Inter-system Dialing, Carrier SIP, Inter-system SIP integration
Designs, engineers and manages Contact Center Call Scripts, IVR prompts and Menu Service Messaging to support all Contact Center and Self-Service operations
Evaluates, tests, recommends and implements specific UC network solutions
Investigates and resolves problems, inefficiencies and enhances UC network performance.
Provides strategic planning and technical support to determine UC business needs within the organization
Plans, manages and provides leadership on project teams, including identification of the project scope, objectives and managing the process for timely project completion.
Creates and maintains all UC network documentation reflecting UC topology diagrams, system and operational standards and utilization of metrics necessary to troubleshoot and maintain a high-level of system performance as well as perform growth and planning needs to ensure system availability
Researches new technologies to improve efficiencies, conducts business case studies to justify need for technology while providing ongoing information to management, peers and customers regarding enhancements and innovations
Manages and supports complex UC problems with vendors and other team members
Required Experience:
5+ years in a technical leadership role supporting in house platforms5+ years configuring and supporting complex Cisco solutions
Advanced technical knowledge of the Cisco Unified Communications Suite including:
Unified Communications Manager (CUCM) routing, call control, and media resources
Cisco CUBE configuration including dial peers, URI dial peers, carrier SIP trunking and translations.
CUCM best practices and Complex dial plan management
CUCM hunt groups, partitions and search spaces; including how to apply them in different scenarios
Troubleshoot complex call flow between endpoints
Capture, read and decipher SIP signaling communication between devices
Cisco Contact Center Express
Cisco Emergency Responder (E911)
Cisco UCS hardware platforms, including Cisco CIMC
Cisco Expressway including routing/search rules, MRA and Jabber
Cisco Telepresence with various video endpoints and Webex
ITIL service management framework and practices
CCNP Collaboration or Voice required
Preferred Experience:
Bachelor’s degree in information systems, Computer Science or Computer Engineering.
Experience with VMware, vCenter and virtualization technologies.
Experience with UCCE and 3rd party products such as Calabrio, ICM/CVP Scripting
Experience in CRM (Salesforce, MS Dynamics, ServiceNow) integration with call center.
Experience in Python, PowerShell, Pearl and working with APIs desired.
It is the policy of CommScope to provide Equal Employment Opportunities to all individuals based on merit, qualifications and abilities. CommScope does not discriminate in employment opportunities or practices on the basis of race, color, religion, gender (including pregnancy), national origin, age or any other characteristics as protected by law. Furthermore, this contractor and subcontractor shall abide by the requirements of 41 CFR 60-300.5(a) and 41 CFR 60-741.5(a). These regulations prohibit discrimination against qualified protected veterans and qualified individuals on the basis of disability, and require affirmative action by covered prime contractors and subcontractors to employ and advance in employment qualified protected veterans and qualified individuals with disabilities.

United States;United States : Georgia || United States : Texas;United States : Georgia : Suwanee || United States : Texas : Richardson",3.4,"CommScope Inc.
3.4","Richardson, NC","Hickory, NC",10000+ employees,1965,Company - Public,Telecommunications Manufacturing,Telecommunications,$2 to $5 billion (USD),-1
9,Sr. Analyst of Paid Social Media,-1,"PURPOSE OF ROLE:
The primary purpose of the Paid Media Sr. Analyst is to support the Paid Media Manager by delivering the daily execution and optimization of digital marketing campaigns. The Paid Media Sr. Analyst will support all aspects of digital marketing channel and campaign management, including day to day campaign stewardship, vendor partnership planning and collaboration, competitive tracking and insight, and campaign performance recaps and communication. The Paid Media Sr. Analyst is responsible for manage campaigns to weekly and monthly budget goals, and will analyze performance data and provide appropriate action plans based on conclusions. This role leverages digital marketing channels to drive in-store and online traffic, deliver total company metrics and optimize ROI for maximum profitability by creating programs from concept to design, or optimizing current programs. Responsibilities include but are not limited to, collaboration on creative and ad copy strategies, determining target audiences based on business needs, preferences or behaviors, monitoring data and data process flows, product feed management, scheduling campaigns (both recurring or ad hoc), tracking results, working with internal tools/processes and external vendors. The Paid Media Sr. Analyst will be knowledgeable about database management and can understand and build programs that involve multiple variables delivered through a variety of sources.

RESPONSIBILITY STATEMENTS:
Reviews competitive market data across marketing channels to influence future project work; Stays up-to-date on industry best practices to infuse into current campaigns as needed.
Indirect oversight of marketing budget for programs; responsible for delivering projects across the organization on time, on budget and on brand.
Responsible for daily campaign execution, stewardship and optimization of digital campaigns in respective channel (Google, Facebook, Bing, Instagram, Twitter, Pinterest).
Develops and implements digital marketing campaigns that support enterprise business objectives across paid digital marketing channels.
Executes A/B testing initiatives to drive improvement in campaign efficiency and effectiveness.
Manages multiple projects and stakeholders to prioritize projects with the most impact on operational goals; helps to influence decisions across the organization to drive consumer relevance and engagement.
Designs and implements processes that solve complex organizational problems from start to finish with limited input; ability to self-start and self-motivate themselves and cross functional team members.
REQUIRED EDUCATION/EXPERIENCE:
Bachelor's Degree in Business, Marketing, Communications or Related Field.
1-3 years experience in Marketing or Related Field.
PREFERRED EDUCATION/EXPERIENCE:
1-3 years retail Experience.
1-3 years Digital Marketing Experience.
Job Type: Full-time

Experience:
Paid Media: 2 years (Preferred)
Education:
Bachelor's (Required)
Work authorization:
United States (Required)
Application Question:
What platforms are you familiar and experienced with executing Paid Media campaigns?
Work Location:
One location
Benefits:
Health insurance
Dental insurance
Vision insurance
Retirement plan
Paid time off
This Company Describes Its Culture as:
Detail-oriented -- quality and precision-focused
Aggressive -- competitive and growth-oriented
Outcome-oriented -- results-focused with strong performance culture
Team-oriented -- cooperative and collaborative
Schedule:
Monday to Friday",2.8,"Ettain Group
2.8","Mooresville, NC","Charlotte, NC",1001 to 5000 employees,1996,Company - Private,Staffing & Outsourcing,Business Services,Unknown / Non-Applicable,-1
10,ADA / Accessibility Tester / Analyst,-1,"RESPONSIBILITIES:

Kforce has a client in search of an ADA/Accessibility Tester/Analyst in Charlotte, NC.

Summary:
The Accessibility Analyst will work with clients to test and validate user interfaces against accessibility requirements and consult on the effective technical implementation of digital accessibility requirements in client systems.

Duties Include:
Individual contributor
Testing (manual & automated) of any new vendor prospects or existing digital properties
Manage automated reporting in dashboard (per assigned segment)
Track & report repeat non-conformance features or functionality that require solutions for the enterprise or segments
Provide assistive tech/product support for internal and client facing levels
Approve project workflows related accessibility efforts and testing for final reporting and recording
Create standards for testing tools, methodologies and standards
Ensures all ADA tools are standards and used for the QA Testing teams to use (i.e.; WAVE, CrownPeak or other vendor automated applications)
Manage and prioritize criticality of issues log
Testing: The Accessibility Analyst will test client's systems against specific manual and assistive technology tools; The Accessibility Analyst will enter test results into Level Access's Accessibility Management Platform (AMP) the industry's first on-demand solution that integrates the business and technical aspects of complying with regulations, such as Section 508, the ADA, and the Web Content Accessibility Guidelines 2.0
Remediation: The Accessibility Analyst will be required to provide realistic technical guidance to clients that can be integrated into current or new user interfaces
Test Set Definition: The Accessibility Analyst will work with the client to determine the boundaries of the testing environment by identifying a representative test set of the user interface components found in the client's system
REQUIREMENTS:
Bachelor's degree in a related area and/or equivalent combination of education, training/experience in web accessibility analysis and remediation
2+ years of progressively responsible experience with ADA compliance
2+ years of experience with alternative media production, web accessibility or assistive technology
The ideal candidate will have significant experience working with HTML, CSS, and JavaScript, and will possess strong verbal and written communication skills
Start your career off on the right foot with one of 'America's Top 500 Companies', as awarded by Forbes. Our client is known as a place where people feel included, valued, supported and respected. Innovative thinking and industry-leading technology allow their associates to thrive and grow in their careers. And with a priority placed on their culture and company principles, their commitment to diversity, ethics and the communities in which they operate is their driving force.

Kforce is an Equal Opportunity/Affirmative Action Employer. All qualified applicants will receive consideration for employment without regard to race, color, religion, sex, pregnancy, sexual orientation, gender identity, national origin, age, protected veteran status, or disability status.",4.1,"Kforce
4.1","Charlotte, NC","Tampa, FL",10000+ employees,1966,Company - Public,Staffing & Outsourcing,Business Services,$1 to $2 billion (USD),-1
